[
  {
    "type": "hello.ok",
    "seq": 11,
    "re": 1,
    "data": {
      "protocol": 1,
      "bridge": "0.1.0",
      "engine": "0.3.85",
      "game": "red",
      "session": "s-7f3a91",
      "tested": "0.3.85",
      "union_room": "off"
    }
  },
  {
    "type": "hello.ok",
    "seq": 12,
    "re": 1,
    "data": {
      "protocol": 1,
      "bridge": "0.1.0",
      "engine": "0.3.85",
      "game": "blue",
      "family": "gen1",
      "compat": {
        "maxDex": 151,
        "maxMove": 165,
        "nick": 10
      },
      "session": "s-7f3a92",
      "tested": "0.3.85",
      "union_room": "off"
    }
  }
]
